{
  "$id": "https://torch-dae.local/schemas/embedding.schema.json",
  "$schema": "https://json-schema.org/draft/2020-12/schema",
  "additionalProperties": false,
  "description": "Declare one selectable model-independent embedding.\n\nAttributes\n----------\nschema_version\n    Contract version; currently ``1.0.0``.\nembedding_id, name, description\n    Stable identity and human-readable semantics.\nofficially_defined\n    Whether upstream material explicitly defines this representation.\ndefault\n    Whether this is the card's selected default embedding.\nnetwork_location, layout\n    Extraction location and ordered tensor-axis notation.\ndimension\n    Optional positive feature dimension.\ngranularity, temporal_hop_seconds\n    Sequence/frame scope and optional frame spacing in seconds.\npooling, projection, normalization, task_head_relation, dtype\n    Transform and representation properties.\nstatus\n    One of ``declared``, ``verified``, or ``unsupported``.\nselection_rationale, evidence_ids\n    Justification and references to supporting evidence.\n\nRaises\n------\npydantic.ValidationError\n    If identifiers, positive dimensions, positive hop duration, or allowed values are invalid.",
  "properties": {
    "default": {
      "title": "Default",
      "type": "boolean"
    },
    "description": {
      "minLength": 1,
      "title": "Description",
      "type": "string"
    },
    "dimension": {
      "anyOf": [
        {
          "exclusiveMinimum": 0,
          "type": "integer"
        },
        {
          "type": "null"
        }
      ],
      "default": null,
      "title": "Dimension"
    },
    "dtype": {
      "minLength": 1,
      "title": "Dtype",
      "type": "string"
    },
    "embedding_id": {
      "minLength": 1,
      "pattern": "^[a-z0-9]+(?:[._-][a-z0-9]+)*$",
      "title": "Embedding Id",
      "type": "string"
    },
    "evidence_ids": {
      "default": [],
      "items": {
        "minLength": 1,
        "type": "string"
      },
      "title": "Evidence Ids",
      "type": "array"
    },
    "granularity": {
      "minLength": 1,
      "title": "Granularity",
      "type": "string"
    },
    "layout": {
      "minLength": 1,
      "title": "Layout",
      "type": "string"
    },
    "name": {
      "minLength": 1,
      "title": "Name",
      "type": "string"
    },
    "network_location": {
      "minLength": 1,
      "title": "Network Location",
      "type": "string"
    },
    "normalization": {
      "minLength": 1,
      "title": "Normalization",
      "type": "string"
    },
    "officially_defined": {
      "title": "Officially Defined",
      "type": "boolean"
    },
    "pooling": {
      "minLength": 1,
      "title": "Pooling",
      "type": "string"
    },
    "projection": {
      "minLength": 1,
      "title": "Projection",
      "type": "string"
    },
    "schema_version": {
      "const": "1.0.0",
      "minLength": 1,
      "title": "Schema Version",
      "type": "string"
    },
    "selection_rationale": {
      "minLength": 1,
      "title": "Selection Rationale",
      "type": "string"
    },
    "status": {
      "enum": [
        "declared",
        "verified",
        "unsupported"
      ],
      "minLength": 1,
      "title": "Status",
      "type": "string"
    },
    "task_head_relation": {
      "minLength": 1,
      "title": "Task Head Relation",
      "type": "string"
    },
    "temporal_hop_seconds": {
      "anyOf": [
        {
          "exclusiveMinimum": 0,
          "type": "number"
        },
        {
          "type": "null"
        }
      ],
      "default": null,
      "title": "Temporal Hop Seconds"
    }
  },
  "required": [
    "schema_version",
    "embedding_id",
    "name",
    "description",
    "officially_defined",
    "default",
    "network_location",
    "layout",
    "granularity",
    "pooling",
    "projection",
    "normalization",
    "task_head_relation",
    "dtype",
    "status",
    "selection_rationale"
  ],
  "title": "EmbeddingSpec",
  "type": "object"
}
